{
  "$schema": "https://json-schema.org/draft/2020-12/schema",
  "$id": "https://aoa.local/Agents-of-Abyss/schemas/office_compatibility_matrix_v1.json",
  "title": "Office Compatibility Matrix V1",
  "type": "object",
  "additionalProperties": false,
  "required": [
    "compatible",
    "created_at",
    "evidence_refs",
    "id",
    "kind",
    "matrix",
    "notes",
    "offices",
    "owner_repo",
    "status",
    "version"
  ],
  "properties": {
    "compatible": {
      "type": "boolean"
    },
    "created_at": {
      "type": "string",
      "minLength": 1,
      "format": "date-time"
    },
    "evidence_refs": {
      "type": "array",
      "items": {
        "type": "string",
        "minLength": 1
      },
      "minItems": 1
    },
    "id": {
      "type": "string",
      "minLength": 1
    },
    "kind": {
      "type": "string",
      "minLength": 1,
      "const": "office_compatibility_matrix_v1"
    },
    "matrix": {
      "type": "object",
      "additionalProperties": false,
      "required": [
        "all_primary_offices"
      ],
      "properties": {
        "all_primary_offices": {
          "type": "string",
          "minLength": 1
        }
      }
    },
    "notes": {
      "type": "string",
      "minLength": 1
    },
    "offices": {
      "type": "array",
      "items": {
        "type": "string",
        "minLength": 1
      },
      "minItems": 1
    },
    "owner_repo": {
      "type": "string",
      "minLength": 1,
      "const": "Agents-of-Abyss"
    },
    "status": {
      "type": "string",
      "minLength": 1,
      "enum": [
        "active",
        "allowed",
        "applied",
        "blocked",
        "completed",
        "draft",
        "failed",
        "held",
        "passed",
        "proposed",
        "rejected",
        "rolled_back",
        "sealed"
      ]
    },
    "version": {
      "type": "string",
      "minLength": 1,
      "const": "1.1.0"
    }
  }
}
