{
  "compatible": true,
  "created_at": "2026-04-22T00:00:00Z",
  "evidence_refs": [
    "generated/multi_office_train_clean_flow/release_train.json"
  ],
  "id": "office_compatibility_matrix_v1_example",
  "kind": "office_compatibility_matrix_v1",
  "matrix": {
    "all_primary_offices": "compatible"
  },
  "notes": "Example artifact for office_compatibility_matrix_v1.",
  "offices": [
    "notary.assistant",
    "concierge.assistant",
    "courier.assistant",
    "monitor.assistant"
  ],
  "owner_repo": "Agents-of-Abyss",
  "status": "draft",
  "version": "1.1.0"
}